id,comment
9576,I should rephrase  I agree with you 100   In my head I meant that they would disagree privately and not necessarily publicly 
9577,They were patriots  We need to stop pretending patriot automatically means hero etc 
9578,American  far leftists   however  do not  We know what direct action is  So maybe we can teach the liberals a little bit about growing some balls in the face of tyranny 
9579,Ever heard of the  Milgram experiment  https   en m wikipedia org wiki Milgram experiment  
9580,"I mean America is basically one placed bullet away from a civil war like scenario  Imagine if say a Russian spy sniper shot at a right wing protester when they all have guns  You don t think all those people would start firing their weapons  Sure some people may have the discipline but I don t trust 95  to keep their finger off the trigger if some shit goes down and that goes for the left wing protesters who also have fire arms  I know that s a pretty wild scenario but you can extrapolate it further  a car misfiring  an accidental discharge of a firearm  an explosive  basically something loud enough and to scare the right person into firing his weapon at the opposition  An injury would really just sell it better 

Do I think this would result in a full blown civil war  No  However all of these gun brandishing protests would be significantly more tense across the country and could be a flash point for raising the bar to actual isolated armed conflict events "
9581,May I suggest  https   www iheart com podcast 1119 it could happen here 30717896   https   www iheart com podcast 1119 it could happen here 30717896  
9582,"The first time a militia goes toe to toe with an actual military will mark the end of that militias insurrection  Fighting soldiers head on is a sure way to get killed  The Cubans  however  taught us that you dont fight the military you fight the economic engine that enables your oppression  

It might be cheaper to wage war on your own country but the logistics are far from simple  especially if things like railways are destroyed  The Interstate Highway system would crumble under tanks trying to deploy across the country to enforce curfews "
9583,I mean the resemblance is uncanny
9584,Hey the facts are all there   If people choose to believe them is up to them 
9585,Are you talking about the 25th amendment  Because the person I replied to wasn t talking about anything that actually exists in the current US system 
9586,the 25th amendment is for cases where the president falls into a coma  its not meant to be for  checks   balances 
9587,"  I honestly have no idea why they even bothered writing section 4 at all

The 25th Amendment is meant for when the President is in a coma   If he s awake enough to write a letter  it doesn t apply 

Impeachment is the remedy for maladministration   Republicans know this  but he s their guy and they think he s doing a fantastic job  

I work with a few Republicans   They think Trump is amazing and Governor Pritzker is becoming a dictator   They had a party this weekend in defiance of stay at home orders   I saw a photo of the party   There were elderly grandparents there   No one was wearing masks "
9588,Used to happen like once a season on 24
9589,bootlickers gonna lick boots
9590,Yeah that s a better choice of words  Every one who goes to war believes they are on the  Good side  
9591,The American  far leftists  quite often tend to direct their anger and balls to  perceived  centrist Dems  I had one threatened to beat my face up after I mentioned the choice I have left is to vote for Biden since Bernie dropped out off the race  Deffinetly not all of them like that but this dude appear to think that anybody that is not as far left as he is are tRump supporters  I am yet to hear one  fare leftist  that have coherent set of ideas about dealing with tyranny  Covidiots  being dumb as they are  has more success in their actions so far 
9592,Yes  also  Stafford Prison Experiment  https   www prisonexp org  
9593,So much fake news around these days but I have faith that the truth will out 
9594,Exactly this  that s why the bar is so high  only situations where the president is in a vegetative state of some kind would reach that level of agreement across executive and legislative branches 
9595," Are we the baddies  

 https   www youtube com watch v hn1VxaMEjRU  https   www youtube com watch v hn1VxaMEjRU "
9596,"Yeah I also had that in mind  

On a tangent  it was mind blowing for me the first time I realized that if I had grown up in Nazi Germany I probably would have been as easily persuaded by propaganda as most other people  

We re  humans  are not as independently thinking as we d like to believe we are 

 I m super liberal btw and lean even more left than most people here in Denmark "
9597,"
As a reminder  this subreddit  is for civil discussion    r politics wiki index wiki be civil 

In general  be courteous to others  Debate discuss argue the merits of ideas  don t attack people  Personal insults  shill or troll accusations  hate speech    any   advocating or wishing death physical harm  and other rule violations can result in a permanent ban  

If you see comments in violation of our rules  please report them 

 For those who have questions regarding any media outlets being posted on this subreddit  please click  here  https   www reddit com r politics wiki whitelist  to review our details as to whitelist and outlet criteria 

   


 I am a bot  and this action was performed automatically  Please  contact the moderators of this subreddit   message compose  to  r politics  if you have any questions or concerns  "
9598,"All this while historic flooding is underway in Michigan  

Because  too soon  doesnt exist anymore "
9599,Come on  there s no way they could have anticipated this   It s not like an impeachment witness suggested this exact type of scenario as a possible domestic parallel to the Ukraine scandal 
9600,Susan Collins gleams   Trump has clearly learned his lesson
9601,"Michigan  Allows Mail in ballots 

 Hey  you weren t supposed to do that thing  I m gonna with hold vital funds for you  

 the fucking rest of the Red states getting ready to hand out their mail ins   ¯    ツ   ¯"
9602,When COVID hit  trump said the States should handle it   When it comes to voting that same policy disappears 
9603,Senate Republicans don t care  because Michigan has swung back to blue 
9604,"Honestly I think if he went through with it  he d regret it  Look what happened in Wisconsin  The Supreme Court ruled that the election would go forward without waiting for mail in ballots  And guess what  Voters voted against the the person that forced them to go to the polls 

Turns out voters don t like being punished  They don t like having to risk their lives to vote "
9605,I want you to do us a favor though
9606,when did it become  illegal  to vote by mail  people have been doing it forever     
9607,Impeach him again 
9608,Quid  Pro  Quo 
9609,"Wait which way did MI vote in  16 

And which way are they going to vote now 

Nice one  giant orange dildo"
9610,Is that the stupidest face a President has ever had  Has to be 
9611,So even if he wins  he could get impeached 
9612,Susan Collins meanwhile furrows her brows and reiterates that she is sure Trump has learned his lesson 
9613,Its never enough 
9614,Cue the talking points that Michigan is very corrupt  and it s OK for Trump to treat Michigan this way 
9615,"And that s exactly it 

DO NOT EVER suggest that Trump alone was the problem 

The Republican Senate let him commit crimes 

Not some of them 

ALL of them 

Every last one 

Romney included 

When they try to pretend that they had nothing to do with this shitshow  their voting record will stand as proof 

This is why we impeached even though we knew they would not find him guilty 

That makes them guilty 

Each and every one 

No excuses "
9616,Michigan is obviously a furrin nature   no Murricun would do that stuff   They maya voted fur trump but them weirdos betrayed our god presudump 
9617,He certainly learned his lesson    
9618,Jfc he looks 20 years older
9619,Why does he always look like he just shit his pants 
9620,He did learn his lesson   Republicans won t impeach him because they are fear his Twitter and the rage of his base 
9621,Guy needs to go  he just needs to fucking go  I m going to stop reading the news because this kind of shit infuriates me and he does it 2x a day minimum  Unbelievable  I don t want Donald Trump telling me what to say and think everyday  he s scum and a complete moron
9622,mr trump  your fired sir
9623,I had been lead to believe that he has learned his lesson though 
9624,All Americans should be able to vote by via  You should be able to download your voting form online  print  and mail  Or you can have it mailed to you first and then you mail it back 
9625,The Michigan 
9626,"It s all very legal and very cool  Article 2 of the constitution gives trump the power to do whatever he wants  if he wanted to he could take a crap and use the constitution and the bill of rights as toilet paper and no one can do anything about it 




                 s"
9627,Can he seriously get away with withholding funding to people who need it  I guess we re going to find out  It s really sickening that Mitch and the GOP are just Ok with hurting people  some of whom elected their sorry selves  They are all just monsters 
9628,vote him out people  vote the pos out 
9629,We need another party   This makes me sick    Everyday it just gets worse 
9630,He learned it from Biden 
9631,Also  he s going there  Tomorrow   Seriously  
9632,If only someone could have foreseen this   
9633,Like when you let a toddler get away with something  they will do it again and again 
9634, deleted 
9635,Oh shit everyone  stand back  Susan Collins is slightly perturbed 
9636,They should impeach him again just so we can have Collins tell us he ll learn his lesson   this   time 
9637,You dropped this    
9638,"West Virginia sent out absentee ballot applications to every voter weeks ago  I sent mine in already have my ballot 

Havent heard a peep about it from trump although Governor Justice has whined about how mail in voting is ripe for fraud   but when questioned about proof of fraud risks he just deflects and moves on "
9639,The funny thing about this is that other states mailed similar applications  They just aren t Michigan  they aren t in the limelight 
9640,Was that during the pandemic 
9641,"I think Wisconsin was a dry run for what the GOP wants to do in national elections and it didn t work in their favor 


Now imagine the ultra crooked shit they re scheming up for November "
9642,This is basically the exact scenario that several Dems gave and the Republicans acted all offended by the mere suggestion that such a thing would ever happen  Now that it s happening where is the outrage 
9643,It isn t illegal  Bloated McOrangeface merely wants to suppress the vote in swing states that look like they ll harm his re election chances  Real quality stuff 
9644,It s been a longstanding practice that we recently made a constitutional right  Our constitution gives us the right to vote absentee without providing a reason 
9645,Trump knows it s going to hurt his chances to be re elected so obviously it s illegal 
9646,Moscow Mitch  No Judge Vacancies Left Behind  Cut Unemployment During a Pandemic  McConnell will just say  let the voters decide  again 
9647,It s coming 
9648,Don t hold your breath 
9649," even if he wins  he   could     should   get impeached 

Yes "
9650,The  Russian senate
9651,Well they say impeachment adds 40 pounds
9652,I think you know why  https   youtu be rQ9qsXu34SM
9653,I wish it were that easy 
9654,That s what Susan said    
9655,Still blows me away that you guys don t get what the massive difference was 
9656,When was Biden a U S  president threatening to withdraw funding from states during a virus outbreak for mailing voter registration forms to their constituents  I missed that one 
9657,You re too full of shit and stupid to be a nurse
9658,He learns nothing from anyone  And since Biden was investigated and was proven innocent  maybe he should have
9659,What does that mean  What even does that mean 
9660,Ford plant visit  Will he where a mask  Will the proud boys show up to cheer him on  Will the citizens of Michigan flee in time from the dam burst  We ll find out tomorrow on the next episode of Dragon Ball Z 
9661,He s going to throw some paper towels at the flood
9662,In my mind I am wishing for the whole show your back protest there but it won t happen 
9663,Gonna throw some paper towels  Mission Accomplished 
9664,Fuck Susan Collins 
9665,She s clutching her pearls and furrowing her brow  Someone bring out the fainting couch 
9666,The Furrowed Brow Caucus released a statement that  while they were  deeply concerned   they intend to continue standing by the president 
9667,O shit thanks cant be walking around out here without an arm
9668,Yes
9669,  https   www youtube com watch v TDgflZKpD8M feature youtu be t 7m00s  https   www youtube com watch v TDgflZKpD8M feature youtu be t 7m00s 
9670,Also  he voted by mail in the last election 
9671,Good  Make him support this publicly   Make him say it out loud 
9672,The voters decided against trump  He s done nothing to change that  I really feel they re going to pay for acting like he s a legitimate politician  Nothing has gone their way since 2016  Wisconsin showed that people will show up in the rain and risk their lives to vote against trump 
9673,"Should be impeached for threatening it  

Should be impeached for blowing off COVID for a month  

Should be impeached for disbanding the task force  

Should be impeached for   "
9674,That s some funny shit 💩
9675,Tomorrow we re gonna get 22 minutes of footage of trump grunting 
9676,"I m really disappointed by the sequence of events there  At first  Ford said he would be required to wear a mask  then backed off that not much later  Hard to imagine that change didn t come as a result of pressure from the White House 

For a famed germophobe  he sure doesn t seem to give a damn about germs or infection and continues to refuse to even take basic precautions "
9677,He ll wear a mask and read word for word a speech some intern wrote and people will cheer him for being  presidential  and there will be articles about him  changing his tune  and  finally taking the pandemic seriously 
9678,The mask requirement was lifted for Donald   yes likely proud boys  nope not in time 
9679,Fuck every single GOP supporter and voter  This shit is about to become riots  Let s see how Trumpssolini deals with that  I bet he s banking on   no way he ll be beaten to death in the streets like his predecessor   Mussolini  was 
9680,No thank you  I wouldn t fuck her with Trumps mushroom dick   
9681,"whew  I was worried we would get all the way to  thoughts and prayers   

we dodged the bullet on this one "
9682,It s just a flesh wound 
9683,doing God s work
9684,Also  he voted by mail in the last election using a non residential address aka committed actual fucking voter fraud 
9685,"      Firing independent Inspector Generals without just cause 

Should be impeached for securing an arms deal with the Saudis without allowing Congress 30 days to review  against the law      "
9686,For making family separation a standard policy as a deterrent to legal immigration  Some of those parents are never going to see their children again 
9687,Better than any other shit coming out of his mouth 
9688,He ll have to take 2 shits before he leaves this plant because he s a fucking disgusting hippopotamus of a person 
9689,And adderall  sniffles 
9690,He only thing greater than his fear of germs is the fragility of so ego 
9691,That may be the plan     but since when does he stick to a script 
9692,A man can dream  Give the Trumps the ol  Romanov treatment to stamp out any future threats 
9693,Who are you  so wise in the ways of Science 
9694,They will play some awfully on the nose song choice  e g  9 5 by Dolly  while touring Ford  They will play it loud like they did GnR to drown out his voice
9695,That means he ll have to flush 26 times   
9696,I dunno  the Crassus Treatment seems more appropriate 
9697,A girl can dream 
9698,I am Arthur  King of the Britons 
9699,At least  What a fucking pig of a human being  Have you seen this clown  He s literally a balloon in a  14 95 suit 
9700,Didn t know we had a king  I thought we were an autonomous collective 
9701,Seriously it s the suits that bother me the most  I know he s not really a billionaire  but he certainly has enough money to buy a better tailored suit  Someone should really tell him that a well cut  high quality suit can actually be slimming  Instead of wearing the cheap looking fabric  lifted shoes  baggy eighties style cut   and enormous clown tie  I get being insecure  and he should be he looks like shit  but he doesn t have to look nearly as bad as he looks 
9702,"You re fooling yourself  We re living in a dictatorship  a self perpetuating autocracy in which the working classes  

Oh  there you go bringing class into it again "
9703,"
As a reminder  this subreddit  is for civil discussion    r politics wiki index wiki be civil 

In general  be courteous to others  Debate discuss argue the merits of ideas  don t attack people  Personal insults  shill or troll accusations  hate speech    any   advocating or wishing death physical harm  and other rule violations can result in a permanent ban  

If you see comments in violation of our rules  please report them 

 For those who have questions regarding any media outlets being posted on this subreddit  please click  here  https   www reddit com r politics wiki whitelist  to review our details as to whitelist and outlet criteria 

   


 I am a bot  and this action was performed automatically  Please  contact the moderators of this subreddit   message compose  to  r politics  if you have any questions or concerns  "
9704,Man  how I d LOVE to se a democrat take Georgia  But he probably won t because of Georgia s wonderful record of voter suppression 
9705,I imagine Biden will need to be up by at least 10 points in GA to overcome the GOP cheating factor 
9706,Also  Kelly leads McSally  Arizona  by a huge margin in a state where it hasn t gone to a democrat in 30 years 
9707,I don t know if Georgia and Texas are turning blue  this  year but they will by the end of the decade 
9708,Biden needs to focus on the core swing states  Don t worry bout racking up the score  just go for the win  A landslide repudiation would be fantastic  but focus on the win first 
9709,"Governor Kemp is the only US governor with a lower approval rating on his handling of COVID than Trump  with  just 39   https   www businessinsider com georgia gov brian kemp sees dismal approval rating post reopening 2020 5  of Georgians approving 

Since they re essentially of the same mind  it s easy to see how Biden could come away with Georgia "
9710,Trump s down in Michigan  Pennsylvania  North Carolina  Florida  and Arizona   Barely breaking even in Ohio  Texas  and Georgia   Biden s about to carve out the future path forward for Democratic nominees  and it s going to be a weird hybrid of Obama s 2012 win  and Bill Clinton s 1996 win 
9711,I m going to be honest  though  Clinton was ahead of Trump in 2016 here in Georgia  too  for a couple months  And even when Trump pulled ahead  he only got 3 5 points up at best  I d love for this state to turn  but I lost faith in the white trash in the hills years ago 
9712,"As a Georgian  never say never but I doubt Trump loses here  

Registered voter surveys often overestimate Democrat support by 2 5 points compared to likely voter polls  

Biden has a unique strength among black voters in Georgia however  So I could see the margin being closer than in 2016 "
9713,Don t care  Vote 
9714,Polls don t matter  Corrupt Kemp is governor  No way the GOP is going to allow GA to go blue  no matter how the actual votes go 
9715,I still think Biden has a very good chance of being Trump  If you say anything positive about Hillary online or in real life  steam comes out of their ears  Hillary was truly hated  and it s possible that Trump only won the first time because Hillary was so despised 
9716,If only Georgia was a true democracy instead of a third world failed state 
9717,"If it looks like Biden is leading in Georgia  or Florida or Wisconsin or Ohio   the state can suspend their election in November for public health reasons or electoral fraud or whatever   Then the GOP controlled state government can pass an emergency resolution to restore their ability to appoint Electors  which is a Constitutional power reserved by the states  to the Electoral College 

They appoint a GOP leaning slate of Electors without an election and in defense against a popular vote that isn t going to go their way 

This is a perfectly legal and Constitutional way to ensure that Georgia  Florida  Ohio  Wisconsin  Texas  or Arizona don t flip "
9718,There s only one poll that matters
9719,It s no wonder he s been freaking out so badly this week  this race is breaking against him in all the wrong ways and it s delightful to watch
9720,"It s been shown that when people get out and vote  places flip 
  
Look at Kentucky in 2019  The Republicans have constantly came out to vote year over year and in increasing numbers while the democrat vote sways year over year by 500 000  
  
When Democrats mobilize  the vote flips  It literally takes a turnout "
9721,Doesn t matter    polls mean shit if folks don t get off their god damn asses and vote 
9722,Biden baby  Bring those strong unions back
9723,Has anyone else noticed that Georgia and Texas both only turned into permanent red states after they installed electronic voting machines 
9724,Exciting but I don t see Biden carrying Georgia considering who their governor is  Kemp is going to do everything he can to steal another election 
9725,Hillary did the same thing  at one point 
9726,I just hope people don t hear about these polls and get complacent about voting  Hilary Clinton was also supposed to win  Every single person who can vote needs to vote 
9727,Trump is like that guy that s horrible in bed that converts his wife to lesbianism  but in politics  converting red states to blue 
9728,Get out and vote Georgia   Make these polls so wrong   make Biden CRSUH IT in Georgia 
9729,I hope Trump loses GA and Texas  It will probably be all over for him if that happens 
9730,I m not greedy  I ll be perfectly happy if Biden wins Texas  That s all I ask 
9731,How beautiful would it be if both coasts go blue  From California and Nevada and possibly Arizona     to Washington state  and from Florida to Maine  South Carolina is  4 Trump so that would be the hardest obstacle 
9732,Biden could be up by 30 points in Georgia and somehow would still lose thanks to the GOP voter fraud in the state 
9733,As a Georgian this pleases me 
9734,Atlanta burns 
9735,Is Joe Biden the new Bill Clinton  Stay tuned
9736,48  for Biden and 47  for Trump and a margin of error of   5  
9737,Uh oh spaghetti ohs
9738,In a state where voting results are literally at the mercy of a few mouse clicks  polling is irrelevant 
9739,They way they count votes in Georgia  does that translates to a major victory for trump 
9740,I can t imagine their governor helping the gop cause with how ridiculous hes been lately 
9741,Fuck yes    
9742,"I don t like biden but I don t like trump

but here is what I don t get

republican Kemp is the SOS   controls the election and that is how he beat Stacey Abrams   I don t like her either but will admit the election was rigged

 there was a 90 year black woman who had been going to same polling place for decades and they turned her away

So anything state wide would great"
9743,Nothing against the OP  but I don t like it when news outlets use the parties as labels  Forget the party names   it would likely be the first time Georgia voted to elect a left leaning candidate  what  ever 
9744,I already know how this election will go  Biden will win by a landslide  Trump will make up anything to disqualify the results  Trumps base will become animated  Fox will go with it  Hopefully there s a transition of power  but it won t be pleasant if it happens 
9745,"Wouldn t choosing Stacey Abrams as VP make Georgia a win for Biden  Without removing one of the Democratic Senators from the Democratic Senate count 

Abrams seems like she would be acceptable to progressives "
9746,Still early  but praying and hoping 
9747,It s not that Biden is that good  it s that Trump is that bad 
9748,If we let up for a second Trump can win  Vote   For the love of God  Vote    
9749,Thanks Kemp
9750,All these conventional red states need is a  white old man  to flip  If Biden could get a bit of racism or be a bully  it will be a slum dunk 🤣
9751,Well they might have voted for one for governer if their votes got counted
9752,Gerogia is led by an illegitimate governer who cheated to win his election and who just canceled an election to illegitimately appoint a Supreme Court judge  There is no way in Hell Biden wins there  regardless of what the actual vote count is
9753,Have no fear  the GOP will just  arrange it  so Trump wins  There is no actual voting going on in those red states  The electoral college can  vote  their conscience and keep all those misinformed poor people from making a big mistake 
9754,Let s not start sucking each other s dicks just yet
9755,Maybe they re tired of watching republicans subverting democracy 
