id,comment
6592,"https   twitter com BillR status 1263167694670610434

  There is a United States Senator who DEMANDED that the Ukrainian government get rid of Viktor Shokin  We need answers from him on why 

  It is time for Ron Johnson to subpoena Ron Johnson  

  Ron Johnson deserves to know what Ron Johnson knew and when he knew it  

  Ron Johnson "
6593,"  weijia  At least 4 White House reporters have pressed 
 PressSec about why the President claimed mailing out applications for absentee ballots is illegal  but she has deferred to 
 TeamTrump   The Harvard Law School graduate does not want to discuss the law   https   twitter com weijia status 1263196705614413824 "
6594,"So Republicans are getting really desperate 

They are planning on sending subpoenas to Hunter Biden  why  IDK  and Obama administration officials 

That type of deflection is not going to work 

Multiple polls show that the  1 issue for voters is the Coronavirus 
And Republicans botched the Coronavirus virus 

That is why even after these random attacks on Biden  Biden is leading in the polls"
6595,"https   twitter com ianbassin status 1263185980325941248

  Brief representing more than 1 000 former DOJ officials who served in Administrations run by presidents of both parties about to be filed in Michael Flynn case "
6596,"She claims it s a campaign related question on the merits of  that s a ballot initiative being addressed by Trump s campaign   

Yet the campaign cannot withhold funding to a state as retaliation for going against their  ballot initiatives   Trump  however  can do that  illegal as it may be  as president  and therefore he is the direct person to ask about what exactly is illegal about the Michigan SOS s decision  


Suddenly it all makes sense why Louisiana has pushed so hard to make our mail in ballot requests fail  they don t want to have their federal funding cut off if they do it "
6597,"https   twitter com Yamiche status 1263198640044195840

  So today  Pres Trump  who regularly votes by mail  threatened to hold up federal funds for two battleground states  Michigan   Nevada   bc they are trying to make it easier   safer to vote during the coronavirus pandemic 

    Then  
 PressSec
 referred Qs about it to Trump campaign   

https   twitter com kaitlancollins status 1263196166503702532

  The White House has repeatedly declined to say what it is the president thinks happening in Michigan that is illegal    Instead referred those questions to the campaign   

That s SHS level deflection"
6598,"Well I m late  but I ll just sum this up because I ve got nothing better to do  Here are the  highlights  for today 

  McEnany opened by praising Trump for fulfilling his promises to bring back American manufacturing jobs  in relation to PPE   rebuking Obama s comment that you d need a  magic wand  to bring them back  She did not give any job numbers to back this up 

  Every time McEnany was asked about what made pushes for mass mail in ballots illegal  as Trump claimed in a tweet  she said to direct questions regarding that to the Trump  campaign   her former employer 

  When a CNN reporter asked about why Trump doesn t support mass mail in voting  McEnany said there has to be a  reason  for doing it  When the same reporter said the virus was a good reason to have it  McEnany snarked  I m glad you have the prediction tool to know what will be happening November 3rd   When the reporter brought up primaries coming up soon  McEnany deferred to the Trump campaign again 

  When a reporter asked about Trump s claim that  thousands of people  on the front line of combating the virus are taking hydroxycloroquin  this launched McEnany into a list of prepared statements  including defending the original use of the drug  listing talk show hosts who mocked Trump for claiming he was using it  Jimmy Kimmel  Jow Scarborough  and Chris Cuomo   bringing up that Chris Cuomo used a more  unsafe  version of the drug  and quoting NY Governor  Andrew  Cuomo about his hopes for the drug  that were made before revelations about it  

  McEnany defended Trump s complaint about Michigan s mail in voting by saying it was directed at the Office of Management and Budget  rather than his base  When a reporter asked why Trump would voice that complaint in the form of a tweet instead of a statement  that doesn t mention the OMB  McEnany said it was a sign of  unprecedented transparency  in the Trump presidency 

  Regarding Trump s comment that the high number of cases was a  badge of honor  for the country  McEnany clarified that it was an indication of how many tests the country has that there were so many known positive cases 

  When a reporter quoted Eric Trump saying that the coronavirus will  magically go away  after the election  implying it s being exacerbated by the Democrats  McEnany said she hoped Trump and his family wouldn t be taken out of context  despite being a direct quote  and that  we should all hope the coronavirus goes away   seemingly ignoring the context of Eric s quote herself 

  When asked about Michigan Governor Whitmer asking why she wasn t invited to an event with the president in her state  McEnany listed the money and resources her state was given  saying  the governor is concerned about an invitation when she should be thanking the president 

  When asked about an op ed from Susan Rice about Trump s response to the virus  McEnany briefly summed up a timeline of Trump s response to the virus  glossing over the month of February  before focusing on an email Rice sent herself about the Flynn investigation and criticized her career  She then said  Thank you for bringing up Susan Rice  not in the context that I wished  but thank you  before leaving "
6599,"  By the way  you never needed to learn the name of Dr  Fauci during the Ebola Crisis  because     BarackObama   https   twitter com BarackObama   just fucking took his advice   

  https   twitter com BradleyWhitford status 1260439847606591489  https   twitter com BradleyWhitford status 1260439847606591489 "
6600,"https   twitter com atrupar status 1263200452579078146

  Asked to respond to a direct quote of Eric Trump pushing a bonkers conspiracy theory about the coronavirus on Fox News  McEnany rebukes the reporter for taking him  out of context "
6601,"  The Trump emails surfaced in the Mueller investigation include the President s son saying how much the campaign would love some Russian dirt on Hillary Clinton  The Obama emails are like  make sure everything s by the book    

  https   twitter com jonfavs status 1262834230553309185  https   twitter com jonfavs status 1262834230553309185 "
6602, Thank you for bringing up Susan Rice  I had a pre written spiel that barely related to what was asked but at least I got to vomit the words out 
6603,"Disclaimer 

The White House Press Briefing is provided for entertainment purposes only  Any advice given by the president is not to be taken seriously or literally  Consult a doctor if you experience a sense of enlightenment  relief  or euphoria while viewing this Briefing "
6604,90k  dead and we re just going to pretend like it s not getting worse 
6605,The condescension in her voice is too much  Also   Maybe you weren t paying attention   Who says this on national television  This would  in my opinion  be inappropriate for a teacher to say to a student in front of the rest of the class  much less the president s press secretary to say to a reporter 
6606,"When explaining why Trump can vote via mail in ballot  but he thinks there s something wrong with people in Michigan doing it  not to mention the more Republican states that are planning to do the same thing 

 He supports mail in ballots when there s a reason  

Come on  there  is a reason  when it s a global pandemic "
6607,I just can t listen to these press briefings anymore  My liver asked me to sit this one out  Anyone who is playing a drinking bingo game  take an extra shot for a fallen player 
6608,"https   twitter com anniekarni status 1263194020626472968

   PressSec
 dodges questions about what  exactly  is illegal about what Michigan is doing with sending out ballot applications  as Trump claimed today 

     Illegality and legality of it  that s a question for the campaign     she says 

lol wat  "
6609,"It s insulting that this shit never starts when it s scheduled to  How hard is it to show up to work on time 

Edit  if I showed up to meetings I was slated to lead a half hour late on a regular basis  I would not be leading meetings  at work anymore"
6610,So Susan Rice is guilty of   actually working on her last day on the job 
6611,This woman is full of shit  Graduates top 1  in law school  goes to Harvard  works for CNN  talks hella shit about Trump  leaves CNN  couple days later starts working for the Trump campaign  Looks sounds like she knows how to argue with given points  the binder  with BS sourcing  also from the binder    Just more of the Trump admin trying to blur the line between truth  and bullshit  Guessing that the     was better working with Trump in her case  so we get to hear this admins BS  from her 
6612,Trump is a weak and pathetic con artists   People that follow him or defend him are vulnerable to scams   Kinda sad really   35  of America
6613,"  As     waltshaub   https   twitter com waltshaub   notes  federal law makes it a   crime   to hold out appropriations in order to intererfere with individuals  exercise of their right to vote    

 https   twitter com steve  vladeck status 1263107753649848320  https   twitter com steve vladeck status 1263107753649848320 "
6614,I know it s a little thing  but should Biden win I hope they make it a point to start everything on time  Just to put the stark contrast right up front 
6615, The rest of the world is currently watching America in the same way that America watched the tiger king  
6616,"It s amazing how the administration just decided to stop doing updates for the Coronavirus Task Force  while the pandemic is just like  I pick you and you and you and you     

 We re just going to focus on the economic side  and everyone s just kind of like   it s Trump  whadda ya gonna do     

I m not shocked  but having lived through the whole 9 11 chapter  this is some astounding  oh well   "
6617,Things are turning on Trump and he is acting more desperate every day in a way that  feel like a downward spiral    He has a bad news cycle every day now   Very concerned about how extreme he will get in the next 4 months as he keeps spinning down and clings harder to power 
6618,She just quoted Jimmy Kimmel like he s a journalist  He is a comedian  ma am  His job is to mock  lady  Settle down 
6619,What the hell did I just watch 
6620,These aren t nearly as fun as the ones where Trump owns himself 
6621,   faint audio message stating that theyll begin at 3 30pm followed by an audible groan from the collective reporter pool   
6622, The President is moving to a new medical regimen  with a special ingredient discovered in jellyfish  
6623, deleted 
6624,"Lmao she said Cuomo tried a more dangerous form of hydroxychloroquine called  quinine  so it s funny that he criticized the president 

TIL  tonic water  https   www medicalnewstoday com articles 323692 benefits of drinking tonic water  is more dangerous than a drug that causes heart rhythm problems "
6625,Lady  Michigan is fucking dealing with record flooding DURING a pandemic and the president is threatening to withhold federal funding  Jesus Christ  these people are so willfully ignorant 
6626,"Trump is becoming increasingly frustrated and he wants to see his staff repeat that sentiment 

Like anyone who isn t one of his lackeys gives a fuck who frustrated he is at his own failure and incompetence "
6627,So what s illegal about Michigan allowing mail in ballot applications  is a question for the Trump Campaign  How 
6628,"Questions about mail in voting are directed to Trump s  campaign   

How much more obvious are they going to make it that it s the Trump campaign  not the federal government  that s calling it illegal  

Trump wasn t speaking for any governmental legal council  He s just campaigning  instead of governing "
6629,No one s taking Eric Trump out of context  If you think it sounds that stupid  it s because it was  Not because it was out of context 
6630,I can t watch the new lady  she s so over the top false that it s painful 
6631,Train wreck incoming 
6632, The president believes in unprecedented transparency      what 
6633,It takes raw talent to be able to be as condescending as she is  That shit cant be taught 
6634,this was some soviet era shit
6635,2005    citing 15 year old data on election fraud 
6636,"Dodge  duck  dip  dive  and dodge

Answer the fucking question for once"
6637,LOL she ragequit after giving an extraordinarily embarrassing non answer 
6638,Gish Gallop about Susan Rice and then sprint out before anyone can ask clarifying questions 
6639,Time for our daily shower of bullshit 
6640,Fuck TRUMP
6641,It seems every answer she has starts with the word  so 
6642," The President has been very clear      


In what universe  blondie "
6643," Fully transparent President  minus those pesky taxes 

Each day this shit show just gets worse and worse "
6644,And what s Susan Rice s last action  To remind the FBI to obey the law while they protect the nation from spies  How dare she 
6645,So what I gather from this answer  Susan Rice is someone I should admire
6646,she always goes on some stupid pre written rant and then scurries off like the rat she is
6647,"Have other admins been this aggressively stand offish 
That was disgusting  and a little insulting "
6648,"Well we had a heavy brunette who was able to lie better than Trump and now we have a thin blonde who is not as good at lies but better at deflecting and not answering questions 

Example  a question about comments from Eric Trump    Answer about everybody wants Covid to end

I very much dislike a holes who know they are being a holes but do not care because this pays the bills   even when people s lives are involved 

Saying that she is employed by the white house so she is not going to answer the question about why only michigan is being threatened by the president and not other states doing same for mail in ballots is incredible in how F ing hypocritical this white house is "
6649,she is the most  Fox News Female Fantasy  woman I ve ever seen  all the way down to her little cross necklace  to show she s a good christian deep down below the evil 
6650,If I were this late to work I d be thrown out on my ear  He just doesn t care whatsoever 
6651,Lol  like we want to visit the US right now even if it were to reopen for EU citizens 
6652,If you re watching this  you re witnessing the fall of America 
6653,"I missed it 

I don t feel too bad because it would have been a waste of time 

Here is an old tune for you all 

 Phil Collins   I Missed Again  Official Music Video   https   www youtube com watch v yr SNCtoyPk "
6654,"They are taking a gamble that the Virus will not have a second wave   I say this because of this administrations statements and the way Trump supporters are starting to act 






I think they have bet on the wrong horse   Reopening this quickly only ensures a bigger 2nd wave   One that will ultimately shut the economy down again while exposing their lies   All lining up in time to vote them out   Including all Republicans on board with killing more Americans in the name of GDP "
6655,Is it propaganda hour again already   Sorry    I know hour is probably generous 
6656," Maybe you weren t paying attention the first time I read it 

What a fucking asshole "
6657," Maybe you weren t paying attention 

Meow    and get fucked you patronising cow"
6658,Where do they get these evil press secretaries 
6659,"It s important to recognize the psychology going into the Trump relief efforts for coronavirus  Trump perceives the problem in two regards  as a reelection problem first  and as an economic problem second  There s no health problem or medical problem to him at all  Some people will die 

The problem  to Trump  is how he looks afterwards  Viewed through this lens  most of his actions in regards to coronavirus make sense "
6660,"    maybe you weren t paying attention   

OMG I hate her so much"
6661,She can t ever answer a question  The amount of masks delivered or not delivered to Michigan  has nothing to do with the question of why Trump won t meet with Whitmer 
6662,She s morphing into trump  Lol
6663,what exactly was the correct context of eric trump 
6664,Just got an ad that says liberals and fake news want to end pressers  but i thought donny was the one who wanted to stop them  Lol
6665,So how long before someone goes Iraqi style on her and tosses a shoe at her head 
6666,OMFG right off the bat  Obama bad 
6667,"Yes let s quote late night talk show hosts instead of all the doctors or studies   

It is approved in specific cases    not Covid "
6668,Which is why he won t release the white house visitor logs  yep 
6669,"I can t believe America is already talking about reopening lmao  Sorry but you ain t close of reopening any time soon  Some countries with much better and faster reaction to the virus in the early days are just starting to slowly but safely reopen  

The U S has suggested a quarantine for one week and a half and then BAM we re open  Back to normal  Virus disappeared  

You guys will see new cases and death for at least a year  The faster you accept this reality  the faster you will get through this  But right now  Talking about reopening is ridiculous "
6670,CNN  MSNBC and FOX  none of them are airing this live 
6671," I will not lie to the media 

 President Trump had an early response to Coronavirus  

 Pick One"
6672,Ah yes  Let s take this time to bash Susan Rice 
6673,Why are they still defending Michael Flynn  If I plead guilty for a traffic violation in my local court  there s no way in hell they would let me reverse that decision without pulling teeth 
6674,Wow  she s a piece of shit
6675,The top two infected countries in the world are led by the same man 
6676,Just a brand new level of pathetic  Keep in mind  this is the absolute best they can do 
6677,Idiot while idiot Trump wines and complaints about fake news  Tired of 4 years of his shitty personality and ready for a new president who is a real president and finally being America to bring the world s light 
6678, However  in early 2015  before becoming a Trump supporter  McEnany was highly critical of him  declaring on CNN and Fox that  Donald Trump has shown himself to be a showman  and it was  unfortunate  and  inauthentic  to call him a Republican  She began supporting Trump after receiving advice over cocktails from Michael Marcantonio  a fellow summer associate at a law firm and a Democrat  He told her  Donald Trump is going to be your nominee   and if  a smart  young  blond Harvard graduate  wanted  to get on television and have a career as a political pundit  you would be wise to be an early backer  
6679, President  Trump  The correct term is Current White House Occupant Donald Trump 
6680,"Remember last time   Trump didn t fire Obama s pandemic response team  he  streamlined  it 

Right into non existence  That s like Jared levels of intelligence "
6681, Rules for me but not for you    mail in voting
6682,No Kayleigh  he called it ILLEGAL  Why is it ILLEGAL 
6683,"Good point  We have a large group of people who are already taking hydroxychloroquine for prescribed uses  We should be able to conduct a quick test to see if they are catching COVID 19  Oh wait   

  Woman with lupus took hydroxychloroquine for 19 years  still got COVID 19  

 https   twitter com WISN12News status 1262948715624574976  https   twitter com WISN12News status 1262948715624574976 "
6684,Transparent President  haha
6685,What does she mean by   ask the campaign       
6686, Potential voter fraud    as in we have no evidence of actual voter fraud 
6687,Reporters need to be on the offensive during these briefings because this is bullshit
6688,"Almost 100 000 deaths  

Such action  Wow "
6689,LOL What the fuck is going on right now 
6690,I had to stop watching  I can t stand her 
6691,So stating that an investigation should be  by the books  is now a bad thing      
6692,This was all planned and written down in advance lol 
6693,Oh little snowflake barbie got her fee fee s hurt 
6694,So the email is less valid because the time at which it was written  Wtf was she going on about 
6695,I closed it when everyone was wearing a mask except for her 
6696,Fuck this whole god damned admin
6697,Donald Trump is an anagram of Damp Old Runt
6698,Bubonic barbie in da house 
6699,Ok serious question   what s wrong with her face  She looks fake as a doll   her face looks like plastic  Am I crazy  
6700,why the hell would that be a question for the trump campaign  
6701,Omg this lady is a moron 
6702,Why is it that these people cannot understand that no one has ever argued that Hydroxychloroquine has been on the market for years  That has never been the argument  no one ever said it wasn t an FDA approved medication    for Malaria 
6703,LOL  They put Quinine in tonic water 
6704,i feel like i am being force fed propaganda
6705,She being fed lines in real time on a tablet 
6706, we ll be here all day    she s gonna bounce any second
6707,The mental gymnastics his people go through to defend him is olympic medal worthy  Jesus christ 
6708,Let me sum it up  WE GAVE YOU MONEY  WE GAVE YOU SUPPLIES  KNEEL PEASANTS 
6709,"They keep saying the Dems were protesting Trump s travel restrictions 

I don t recall too much of that "
6710,"She is so proud of herself for hitting these lines   They prolly spend an hour or two practicing 

It s borderline obscene 

 edit  words"
6711,Jesus fucking christ please let this nightmare end soon 
6712,These people are just absolutely despicable 
6713,Wow what an awful awful human being 
6714,She has never had one of these last longer than 30m  What a POS 
6715,Nice  didn t know this was happening until it was already over
6716," NO QUID PRO QUO 
Gaslight  Obstruct  Project"
6717,Impeached President Doo Shoes has shit for brains
6718,let me guess  glorious leader can do no wrong   100k dead ain t so bad plus black man is at fault 
6719," Dodge  duck  dip  dive   deceive  and dodge  


Wonder witch one she ll focus on today   "
6720,♫♫It s Twumpy s Widdle Peeworm Show ♫♫
6721,Yeah  no  Don t need an update from space station Trump  She has nothing of value to say 
6722,God what a poor lash choice  Sarah Huckabee Sanders s makeup artist is clearly not in quarantine 
6723,What a bogus answer 
6724,Scared of getting sick is a reason 
6725,Republicans just want to suppress votes  Horrible political party 
6726," Safe reopening of several States 

That s a lot of States reopening in an unsafe manner "
6727,You can see her starting to question her own defense of his bullshit  Small little glimpses of insecurity but they re there 
6728,omg  she just called quinine an unsafe drug        me passes around the bottle of tonic water 
6729,Wow CNN and MSNBC not showing it 
6730,Does she really need to have those stripper eyelashes next to the cross on her neck     
6731,She s so patronising 
6732,"Jimmy Carter    really  

Anyone more recent "
6733,Here s a start  disband the TSA 
6734,I m so glad she provided an example of what WOULD BE voter fraud     but no examples of actual fraud  Typical 
6735,"6 dead   Safe


Hm  shockingly I don t  feel  safe "
6736,haha  making her defend Eric Trump  lol
6737,i predict she ll get flustered  spin a question to  tHe mEdiA  and slink off stage by 4pm
6738,he wont meet with her because strong women scare him  not like Kayliegh  who blew her way to this position 
6739,Susan Rice is a badass
6740,"Are we just going to ignore the fact that Trump got booted out of these briefings because he couldn t behave appropriately 

Trump is an obese toddler"
6741,REAL RICH for someone representing the fucking Trump administration to lambast anything as a lie    
6742,Deflection at its worst 
6743,Spin masters gotta spin
6744,"Missed the press conference but I m assuming it was bad because right at the top of his show CNN s Chris Cuomo says Trump  has three tools in the face of criticism  deny  lie  and defy  

That is a correct assessment imo    but why is Cuomo always rhyming  lol"
6745,I take it Bullshit Barbie is on stage  can t watch right now 
6746,You can tell she knows she s full of shit  She sounds like a 9th grader giving a class presentation on a book she didn t read 
6747,I hate saying this about a fellow woman but she is an absolute b         
6748,Obamagate  rage quit 
6749,I kinda miss Sarah Huckabee and really miss Spicer
6750,If there is wide spread civil unrest in the event trump doesn t win the election  refuses the results  attempts to postpone the election etc  whatever nightmare we re headed towards what happens when the rednecks attack candace owens  stacey dash and kanye west because they can t tell the difference between them and all the other brown people 
6751,i m already cringing 
6752,when doe sthis turd show start
6753,Did it start yet 
6754,Swear I saw the camera guy on the right sigh and look at his watch 
6755,"Leadership of Trump 

What do you mean"
6756,"Oh my god she wore a pink suit  Blasphemy   s

They complained when Obama wore a tan suit "
6757,CNN  MSNBC and FOX    none of them are airing this live right now 
6758,So basically the government is inefficient and can t do what the private sector can do  Got it 
6759,Lmao  bombshell right off the bat
6760,So  I won t get into that   
6761,Good  keep hammering 
