id,comment
8543,"While progressives disagree with you  as long as you are not a massive hypocrite and you believe in the values enshrined in the Constitution  you re probably not a monster to most progressives  

The problem most opponents of Republicans and Conservatives have isn t that they re conservative  but that they so frequently act in bad faith  Fox News went from questioning if Obama wearing a tan suit was disrespectful of the Office of the Presidency to being silent while Trump rallied his considerable twitter following  to bully a 16 year old  presumably out of jealousy that she was on Time Magazine  

The Democrats made Al Franken give up a very hard fought Senate seat over sexual misconduct inappropriate behavior allegations from 2006  I ve yet to see evidence of Republicans holding their own members to such a high standard of personal conduct  which is something that we sorely need in this country "
8544,Yet you ll line up like all the other conservatives  and vote for Trump in November anyways 
8545,Trump s administration is the most  lowercase l  liberal in modern times 
8546," It s his first time as President 

An actual defense they use "
8547,Sounds about right 
8548,Wouldn t surprise me if we found out Vince Vaughn literally showed up at one of these shindigs   dude by all accounts gargles Trump s mushroom batter 
8549,Upvote for Vince Vaughn reference 
8550,"Vince Vaughn  You re money  Mike  You re money   
  
Pompeo  No  your money "
8551,Also Reba McEntire
8552,Or  have the  president  fire the IG investigating the whole corrupt affair   Ooops  too late  at least trump is quick to get people that follow the letter of the law or follow the constitution out of the White House as fast as possible 
8553,Don t hold your breath 
8554,Maybe he meant Strain The Swamp  as in get rid of all the water and just keep all the muck 
8555,They spent TRILLIONS on things Trump has caused so     
8556,A  16 muffin IS a crime but not by Obama  Who TF sells a muffin for that much
8557, More ketchup   Trump could be overheard demanding from staff before he trilled on again with flute song 
8558,All that tax money we ve been paying  and this pompous asshole just blows it on harps for dinner parties
8559,Source 
8560,When you can t argue the actions  try to discredit the source 
8561,"Nixon  76 Criminal Indictments  55 Convictions

Reagan  26 Criminal Indictments  16 Convictions

Clinton  2 Criminal Indictments  1 Conviction

GW Bush  16 Criminal Indictments  16 Convictions

Obama  Zero Criminal Indictments  Zero Convictions

Trump   Still counting indictments  Eight Convictions  and counting "
8562,Obama threw State dinners for FOX hosts and GOP doners 
8563,You get to be blatantly corrupt and break laws when you WIN  Ok then 
8564,So Trump did not drain the swamp then as promised 
8565,Unfortunately that person reports to the person doing the corruption 
8566,Yes  especially after the vote in November  When they leave peacefully after suffering electoral defeat   s
8567,And government  Republicans have spent decades railing against the federal government  so now if they do things to deliberately damage the government and its institutions  it s equivalent to standing up to  the man   even though the government is really just  us  
8568,And economically forcing people to live next to chemical plants and eat Monsanto food 
8569,Yep  anytime democrats do ANYTHING  Dijon mustard  tan suit  it s a scandal  but when republicans do obvious illegal things   it s not a scandal  it s  owning the libs  and therefore ok
8570,They ve programmed them such that muttering  Obama  is a reset switch 
8571,lol  have you been speaking with my brother 
8572,Oh  then by that logic anything is ok then 
8573,"Carter  Truman  Eisenhower  Kennedy  Roosevelt  

Name any of these men personally robbing the taxpayers  not members of their administration  as that is not the basis of you claim  though if you can do that  go ahead  them personally "
8574,Too bad there isn t a guy who could run on the basis of the people in power now are corrupt  put me in and I ll get rid of all that trash  His platform could be  sewer the sump  or maybe  clear the marsh   Then he could hype everyone up on how he is gonna stop the criminal wasting of tax payer dollars and make everyone chant  imprison them away   In regards to anyone that did that kinda corrupt shit  And because so many people agree things are corrupt  they will vote for him and then finally the corruption can    be used to that con man s benefit for once 
8575,yeah  it s called the republican party
8576,They are dredging the swamp
8577,Can inmates even run for office  Would think that could hurt their chances in 2028
8578,He was a wise man indeed
8579," While progressives disagree with you  as long as you are not a massive hypocrite and you believe in the values enshrined in the Constitution  you re probably not a monster to most progressives The problem most opponents of Republicans and Conservatives have isn t that they re conservative  but that they so frequently act in bad faith  Fox News went from questioning if Obama wearing a tan suit was disrespectful of the Office of the Presidency to being silent while Trump rallied his considerable twitter following to bully a 16 year old  presumably out of jealousy that she was on Time Magazine The Democrats made Al Franken give up a very hard fought Senate seat over sexual misconduct inappropriate behavior allegations from 2006  I ve yet to see evidence of Republicans holding their own members to such a high standard of personal conduct  which is something that we sorely need in this country 

Ummh dude  I understand that you re trying to be cordial but a conservative by definition is a hypocrite  I mean  the term conservative stems from those who don t want progress and wants things to return to the way they were in the 60 s "
8580,"I voted for Biden in the primary specifically to beat Trump 

My strategy is to vote conservatives into Congress and Biden in the White House   Historically  divided government works best "
8581,So he doesn t just    play    a raging douchecanoe 
8582,He s from the  North Shore  area in Chicago  Big money up there and not too many progressives 
8583,If only we d figured it out four years ago
8584,Dude  everybody is saying it   
8585,I have an INSIDE HER TIP   C mon man   
8586, deleted 
8587,It must be nice having the DOJ in your back pocket  A media at your beck and call and an opposition party to afraid to push back    until now  Shit the GOP is still too afraid to not get walked all over  We live in a political environment where Democrats can pay for a fake foreign dossier use it to create the need to spy on political opposition for years all while trying to tell the world that that opponent is doing exactly what you have already done  Everyone knows that that s reality and still nothing is done about it simply because they re Democrats and they ve been defined as correct by other Democrats 
8588,You ll think anything is corrupt if reddit told you so lolol  And that s why dem s continue to take so many L s
8589,"Good thing that corruption isn t wide spread throughout almost an entire political party

 s"
8590,"That s just for the ideologues  Living in a red state  this is the logic I ve seen from a lot of regular people  

  People using  insert social welfare program  are lazy thieves who just don t want to work  and they re stealing my hard earned money 

Then  when it comes to tax wasting like this from a Republican 

   shrug  Well  can you blame him  He s the  insert prestigious position   anyone would take advantage of that  

The ones who don t say it this plainly usually just divert to  Well  everyone does it  And Democrats are way worse  "
8591,Didn t say that  By my logic though  it s not fair to leave out the equally corrupt Dems 
8592,I don t disagree with you  but I really don t understand the purpose of quoting a person s entire comment back at them 
8593,The word  Conservative  is just dog whistle talk for  racist   It s that simple  They are all monsters  Don t care if they like Trump or not  Sick of racists playing good cop bad cop   Never Trumpers  who still say they re  conservative  Just want more genteel racism 
8594,I do not entirely agree with this  but I can respect it 
8595,Who s on the inside 
8596," It must be nice having the DOJ in your back pocket  A media at your beck and call 

Fox   Friends is and has been the most viewed news show in the country  What the fuck are you talking about "
8597, I can t defend the wrong thing that Trump is doing  So I m going to paint someone else  who s not been in power for 3 years  in a bad light 
8598,Yes  cling tightly to that whataboutism instead of wiping the shit off the walls of your own glass house 
8599,Like the massive L the Dems took in 2018 when they overwhelmingly took the House 
8600,It s illegal to use federal resources for this type of shit  Same reason it s illegal to ask State Dept employees to run your errands  All this just shows how little this administration or its supporters care about rule of law  I wish y all would just stop pretending already 
8601,At the moment they are trying to one up each other with brazen acts of tax payer theft 
8602,"Good thing everyone is using  s to make it clear they re being sarcastic 

 s"
8603,"Good thing that the checks and balances system is robust

 s"
8604,Or you say  insert fucked up corrupt thing the politician did  and they say  well yeah but did they break the  law    Then you point out where they manipulated current laws  and where they broke them  and the other person just doesn t give a shit   No way to debate with that 
8605,Well said  I will use this later 
8606,Can t have the poors taking advantage of us    poors 
8607,Their brains are wired to be selfish  That s why they re fine with fellow Republicans being selfish  it s a reflection of themselves  but are against Democrats doing anything as they re selfish and don t want them to get or accomplish anything 
8608,Compare the indictments between the parties going back as many administrations as you like  then get back to me on  the equally corrupt   Democrats  It doesn t hold water 
8609,No  it s a nonsensical and distracting and very predictable tactic  You call out corruption as it comes up  If someone commits murder you don t say   well some other guy committed murder in some other instance and we have to discuss both now  
8610,"  I don t disagree with you  but I really don t understand the purpose of quoting a person s entire comment back at them 

Now you can t change what you said to save face "
8611,I do that so people could see what comment I was replying to 
8612,I m brown 
8613,I m inside you
8614,Lol the house  C mon now     don t be ridiculous  Explain to me how dems control 90  of the media narrative continuing to write hit piece after hit piece on the administration  yet we ll still win in a land slide later this year  That will be a historic L for the dems  and I can t wait to see the look on people s faces like yours    sidenote  look at the source on this article  Vanity fair   C mon   what a joke of a media source lol
8615,"Just glad Vanityfair had the guts to call it what it was  

The CNN post is filled with shit eaters saying  they re called state dinners and all administrations have them 

Fucking losers don t even understand they re being stolen from"
8616,"It s a good thing Republicans are the rule of law party that loves to be tough on crime 

 s"
8617, s  s
8618, And then it ends like this  https   imgur com 4quf3HR 
8619,"Not that this is wrong  but from my experience  they really do think everyone is like them  just as opportunistic  just as willing to bend the rules to get ahead  And they assume the only reason everyone doesn t break the rules is for the same reason they don t  fear of being caught  So when it becomes partisan  it s just a game to them   Everyone s up to no good  and people complaining about wrongdoing are being disingenuous  just trying to score points   they think   so politics is just a game of  catching  the other team  Playing defense  and scoring goals  

Even if they don t all have the game aspect quite that literally expressed in their brains  this does seem to be the logic by which they proceed  Some is wiring  but I attribute a lot to culture and education  as well  When they don t understand the values of civic principles  it s a lot easier to become cynical about them  and not understand  or not really  feel   the value of these principles "
8620,THAT is your barometer  Please  OP s concern was wasting of tax money  Let s not pretend that Dems aren t kings of that kingdom 
8621,Wasn t me that said it  though 
8622,"  I m brown 

The Face Eating Leopard Party will eat your face too  while thanking you for your vote "
8623,Who is
8624,"Lmao if you think they control 90  of the media 

And yeah  the House votes totally every two years and represents the best of how America is voting right now  so that was huge  Trump is not doing well in the polls right now  much worse than what he was doing for Clinton 

And funny that you are defending criminals lol "
8625,Two negatives make a positive
8626,This is very well put  It s always been a thing in American politics  but these days large swaths of the GOP think of it as though they re supporting their local college football team and the mainstream media are the refs paid off by the dems  the other team 
8627,"  Let s not pretend that Dems aren t kings of that kingdom 

Total bullshit  

 According to a total from the GEO from the second quarter of this year  the amount of public money spent in an attempt get former Secretary Clinton was around a staggering  22 million on the Benghazi 

Great job there  You really got her "
8628,It s true  Republicans increase the debt more than Democrats too 
8629,I was just explaining the reason to quote the entire text 
8630,No  Who s inside him  I m inside you 
8631,Yeah  the idea was that I was being sarcastic about there being an end to sarcasm since there were so many  s
8632,"
As a reminder  this subreddit  is for civil discussion    r politics wiki index wiki be civil 

In general  be courteous to others  Debate discuss argue the merits of ideas  don t attack people  Personal insults  shill or troll accusations  hate speech    any   advocating or wishing death physical harm  and other rule violations can result in a permanent ban  

If you see comments in violation of our rules  please report them 

 For those who have questions regarding any media outlets being posted on this subreddit  please click  here  https   www reddit com r politics wiki whitelist  to review our details as to whitelist and outlet criteria 

   


 I am a bot  and this action was performed automatically  Please  contact the moderators of this subreddit   message compose  to  r politics  if you have any questions or concerns  "
8633," In the opinion of a senior Trump administration official who requested anonymity out of concern for retribution   if the president knew about any of this  he would have fired Pompeo months ago  

 X  Doubt"
8634,I ll never forget a passage in one of the books I read book where it says that the parking lot at the white house went from mostly SUV s  Honda s etc  when Obama was there to Maserati s  Porches etc  when Trump took over  I think that says it all 
8635,Don t forget the  8billion arms sale to the Saudis
8636,This is mike pompeo building a network of people with influence   in case   when he runs for something
8637,I don t have much of a problem going all out for diplomats and heads of state   putting our best foot forward and showing off is part of the game  That said  the article points out only a small minority were actually involved in diplomacy at all  These were basically fundraising parties for him and Trump 
8638,For all of the idiots that wanted government to run like a business  this is your reward  Businesses constantly give massive parties and perks to their executives while starving the workers  Congratulations on getting what you asked for 
8639,The people who continue to support these fuckin clowns are the same ones who complain about the single mothers using EBT to buy food  the   why do poor people getting handouts get to eat steak and drive nice cars  MuH tAx DoLlArS    headass people 
8640,"I expect any formal diplomatic events to be like this  

Make no mistake  this is not a formal diplomatic event  it s a fundraiser dinner  

Also remember guys  there s not enough money for another stimulus check to go directly to Americans in need during a literal global pandemic and depression "
8641,What happened to the  small government fiscal conservatism  that republicans promised  I got banned from r conservative for saying that Trump isn t conservative  They can t handle the truth 
8642,"LOL remember when the Republicans were mad about Nancy s fancy impeachment pens 

Super stoked to hear about how this is somehow different  

Mike Pompeo is a fat  snide  utterly corrupt kleptocrat  I m sure he ll have a long and prosperous career "
8643,"Canadian  Conservative  member of parliament and cabinet minister was forced out of politics when it was discovered that she d paid   16 for an orange juice   https   en m wikipedia org wiki Bev Oda  at a fancy hotel and billed taxpayers  There were other egregious expenses on the trip  but the orange juice really stuck because she didn t like to walk anywhere and could ve gone to a nearby 7 11 and got an OJ for two buck or less  

If she d done what Pompeo did  she would have been gone in minutes instead of weeks  We ll see what happens to him  nothing will happen to him  "
8644,Stealing millions of tax payer dollars to convince other people to donate millions to their  campaign contributions  slush funds 
8645,"Dems need to get video or just straight up recreate this shit for election ads in every dumb ass hill billy Trump voting district in the nation 

Voice over by Howard Stern 

  Hey fuck nuts  ya  you dumb ass  Take a good look  Now look away from the TV  Get it  This is what your shitty ass life is so fervently supporting  


I m  insert Democrat s name here  and I approve this message  "
8646,These are thefts committed against the American people 
8647," It s unclear if Linick was looking into the dinners  but one senior Trump administration official said  if the president knew about any of this  he would have fired Pompeo months ago  

This ought to be interesting"
8648,Looting is the objective 
8649,Holy fuck America  you guys oligarchy hard 
8650,If Biden wins  I hope he goes after all of these people for all of the money they ve stolen from the tax payers 
8651,But Obama         Nope  this is the most disgusting administration I have ever witnessed 
8652,And yet r Conservative are complaining about how that single mother with 2 part time jobs on food stamps is DRAINING the life out of the economy
8653,"Goody Bags  How very Hollywood Oscars of him 


Wonder what products he promoted  Lysol  Chlorox  Free samples of hydroxychloroquine "
8654,And now you know why the IG was fired 
8655,Obese Boys Are On  A Roll
8656,And I can t get a  1200 check 
8657,"  one senior Trump administration official said  if the president knew about any of this  he would have fired Pompeo months ago

Well that s just utter bullshit "
8658,I  as a taxpayer  don t remember approving a Harpist
8659,"Yet  we re  freeloaders  for wanting basic human rights and clean air and water  

Being gaslight to hell and back sure is getting old "
8660,"This is the best tl dr I could make   original  https   theweek com speedreads 915535 taxpayers paid food harpist goody bags pompeos frequent 500guest formal dinners  reduced by 72    I m a bot 
     
  Secretary of State Mike Pompeo regularly held taxpayer funded  500 guest formal dinners   and President Trump reportedly knew nothing about them 

  Pompeo invited more than just diplomats to his dinners  and sent the bill for food  entertainment  and goody bags to the U S  government  NBC News reports 

  Pompeo held about two dozen Madison dinners since he took office in 2018  and they were scheduled through October until the coronavirus hit  NBC News reports via dinner guest lists and State Department calendars 


     
   Extended Summary    http   np reddit com r autotldr comments gne0bg taxpayers paid for food a harpist and goody bags      FAQ  http   np reddit com r autotldr comments 31b9fm faq autotldr bot   Version 2 02   489558 tl drs so far       Feedback  http   np reddit com message compose to  23autotldr  PM s and comments are monitored  constructive feedback is welcome       Top   keywords     dinner    1   Pompeo    2   State    3   News    4   Madison    5"
8661," It s unclear if Linick was looking into the dinners  but one senior Trump administration official said  if the president knew about any of this  he would have fired Pompeo months ago  

It s so bizarre to see Trump people still believing their own bullshit  Trump doesn t give a shit about using political office for personal gain  he and almost every single other cabinet member have documented cases of doing it  And the ones that were fired  Price  Pruitt  were only after the offenses became so egregious and the condemnation became universal  Who is this  senior official  trying to fool "
8662,Fuck all of them  Seriously fuck every politician and high society fund raiser that continue to act like more than 30 MILLION PEOPLE are not living without a secure income to feed their families  or even to afford going to a god damn hospital visit to save their own life  This kind of shit ain t limited to Pompeo or that orange fuckhead either  Things need to change  like fucking yesterday  
8663,Where are all my   drain the swamp   and   fiscal conservative   friends 
8664,That s bad and all  but I m more worried about the illegal Saudi arms sales 
8665,Pompeo is a pig
8666,What s the point of power if you dont get to pillage the coffers 
8667,"Republicans  Spending taxes on helping poor and hungry people is theft and is a net immorality 

Also Republicans  This is fine "
8668,The idea itself isn t a bad one  Formal dinners are a great way to make connections  have under the radar talks  and build goodwill and rapport  But the execution here is clearly cronyism disguised as diplomacy 
8669,Phew     just imagine how bad this would have been if we hadn t drained the swamp
8670,what the fuck is more  coastal elite  than hiring a fucking harpist  Like how do the MAGA folks vote these people in because  they are relatable 
8671,"Pompeo thinks he has a political future   He has tied himself to the mast of the Trump ship and if it goes down  so does he 

Pompeo also seems the sort to do whatever it takes in order to get what he wants   So  like many Trump sycophants  we should all be wary of the shit these guys are willing to do to keep Trump afloat "
8672,Sorry but we have to cut funding for food stamps to pay for more goody bags   How American of you 
8673,When working people are unable to get off of public support because their employees pay them the bare legal minimum  when parents are leaving their kids alone to work nights so that they can afford food  when people are rationing medication that actually keeps them alive  throwing opulent meals for 500  people with taxpayers  money is nothing short of criminal  I wish I could put all of these parasites together in the wilderness with a ferro rod and let them survive or die 
8674,Well  ya gotta have a harpist 
8675,I m reasonably certain James Madison never invited hillbilly singers and guys who drove carriages around in circles to his intellectual soirees   and he and his fabled wife  Dolly paid for them out of their own coffers 
8676,"  Some of those less diplomatic invitees included Reba McEntire     

Well  Fancy  you really fucking let me down "
8677,Pompeo is a disgusting fat slob 
8678,What was that about the swamp again 
8679,"          and they all enjoyed harp music           

Not sure everyone on there enjoys harp music  but I get the point"
8680,I m willing to bet the goody bag contains some shit from a company his wife works for 
8681," Puts ear up to screen 

  I am not hearing those conservatives who whined about Obama for everything  Maybe I should try the other ear  Nope  they are still silent  "
8682,Strange  Despite my apparent sponsorship I never once got an invite   pretty rude if you ask me 
8683,"I hope that once the Trump administration is removed by the voters  we can begin to pursue charges against this band of thieves  

The most corrupted psychopaths the world has ever seen from the U S   and that s saying a lot "
8684,We re going to need a bigger prison 
8685,VOTE  Drain the swamp 
8686,I wouldn t even think to get a live harpist to play for a dinner  What the fuck world do these people live in 
8687,Remember these stories when he runs in 2024
8688,Sounds like Pompey is going for the Hermann Goering slot 
8689,Maybe the Inspector General s office should have a look    oh yeah  never mind
8690,The biggest lie being told to taxpayers in America today is  we don t have the money  
8691,How is that draining the swamp going for you MAGA guys 
8692,The Trump presidency has been like a weird short story about Marie Antoinette being POTUS 
8693,Imagine the collection of giant assholes who attend those things 
8694,We seem to have many politicians who think the US Treasury is there personal piggy bank  How long will taxpayers in this country continue to put up with this  I can assure you that proportionately common people pay more in taxes than the fat cats  who are robbing us every chance they get 
