id,comment
7444,Nobody said people don t need support for Apple products  The difference is that when I contact Apple for support with a product  I don t need a third party to help navigate the support with Apple  Based on the comment Lee made about his staff helping constituents navigate support with agencies in Virginia  that s an example of needing a third party to help navigate that government agency  I applaud his team for providing the assistance  The larger opportunity is to expect better service and efficiency from government agencies  thus eliminating the need for third party help to get support from the agency that should deliver that support 
7445,Democratic platform for 2020  Support for AIPAC  Maintaining the War on Drugs  Support for KSA  support of for profit healthcare  drone strikes and endless wars  no prison labor reform    Sounds like a whole lot of nothing to me
7446,"Of course you find it shallow and useless because you fundamentally misunderstand the  establishment  premise on which it is founded  The establishment is not some shadowy cabal making orders from behind a curtain  It s regular people employing subterfuge  sabotage  and violence to promote and maintain status quo systems of exploitation for the benefit of them and their co conspirators  The establishment is everyone involved with selling the Iraq War lie to the American people  The establishment is everyone involved with selling lies about the efficacy and savings Medicare for All would create  The establishment are the ones who made sure the covid stimulus mostly went to the wealthy and the establishment are the ones doing insider trading 

The establishment is NOT Batman villains sitting in a lair plotting on how to conquer the world  Get a grip "
7447,"I don t entirely disagree but I would argue the system is absolutely the problem  or at least what the system has become  Did you know 2 3 of congressmembers were millionaires before they were in congress  And they got into congress by taking corporate money  and when they re done they ll go into private industry so they have to make sure they do right by business while they re serving  with the interest of the people serving as a secondary motivation  You can look up how much public opinion reflects legislation that gets passed  very little  and how much the desires of the top 1  reflects legislation that gets passed  almost all of it   When push comes to shove the capitalists in power in congress will always side with the capitalists in charge of the economy 

I understand your feeling because I ve seen people on the left who want to cancel AOC because of stuff she says sometimes  which I think is absolutely absurd when you look at the real stuff she fights for every day  But you have to draw the line somewhere  why should I be on board with what Nancy Pelosi is doing as she draws from the same Democrat playbook of offering very little materially  means tested tax credits  for example  while trying to appear like she s standing up to Trump even though she s supporting expanded border security and military budgets  and giving no support to actual inspirational progressive policies like the Green New Deal  We need to demand much better from congresspeople and the best way to ensure that is to support candidates who don t take corporate money and actually want to change the world for the better  people whose goals happen to align with those of socialists "
7448,"I don t agree with the view that voting for Biden would be  rewarding the behavior  of the party  It should be about expected policy outcomes first and foremost  In our current system there are two viable candidates for president  The one that is closer to progressive values is Biden  That doesn t mean he s progressive  it doesn t mean that he s a good candidate  and it doesn t mean that he s above criticism  It simply means that  between the two  he s the better choice  

If you care about marginalized people and communities  it would make sense to want to lessen the harm done to them  I think it s inarguable that another four years of Trump would be more harmful to them than four years of Biden   For me  that s what it comes down to  If I was in a swing state I would vote for him without hesitation and immediately go back to putting pressure on him and the Democratic party 

I think the issue that a lot of people have  and that you re touching on  is a very real one that shouldn t be ignored  Corrupt and disgusting behavior by establishment Democrats and their apparatchiks should be highlighted and discussed  A lot of them want people to ignore it and pretend that it doesn t exist  which is ridiculous and intellectually dishonest  I just don t think that the logical conclusion is to abandon electoral politics or vote third party in a swing state  especially when it will result in the constituencies  poor and working people  not only here but around the world  that we care about being negatively affected more than they would under a Biden presidency "
7449," He isn t for M4A  he isn t for a GND

People had an option  and they chose not to go with M4A   If people wanted it so desperately  then Bernie would have won out 

Joe has made the GND part of his platform   His plans are not as aggressive as Bernie  a more moderate proposal implemented now is better than a more aggressive one implemented in 4 10 30 years down the line   

Sure I would have loved to have a candidate with a more aggressive climate proposal  but the rest of Bernie s candidacy pretty much killed that as an option   

If you re only option is demanding everything  you re going to be sitting around waiting forever for the perfect candidate "
7450,"Yes  your activity is relevant  so that people know how seriously to take your engagement with a discussion 

The goals at hand are to remove fascism and corruption from the government  fight climate change  universalize healthcare  universalize college education  reinstate oversight and regulations  reinstate and protect civil liberties  relieve burdens on lower and middle class households  rebuild geopolitical trust  and repair independent justice systems "
7451,"  Why are Biden supporters so adamant on not doing the slightest work on his behalf 

Do you have a single shred of proof this is true  Because I keep seeing people like you claim it  without   anything   "
7452,"Would you let Lee operate on your husband or wife in order to measure his effectiveness as a surgeon  or would you instead require that he first demonstrate to you that he has the knowledge and expertise to successfully complete the operation 

As to the second part of your question  from another post   I d like to see that candidates for public office have the discipline to have first completed an undergraduate degree at the very least 

I also wouldn t vote for a person that hadn t made some effort to learn more about public policy and the law specifically  For instance  interning with their local Congressperson  Mayor s office  or law office 

Elected officials should be required to have demonstrated those abilities that qualify them as public servants through education and personal experience  I think that s both reasonable and fair "
7453,"Shared ignorance is not a  value  

But thank you for demonstrating my point about why we want educated  qualified elected officials "
7454,"Popular opinion doesn t make a candidate or elected official qualified 

I would refer you to our current President 

The American voter needs to demand more from their public servants  

And it starts by establishing a minimum standard of qualification for elected office "
7455,Lee s staff is no more a third party in relation to Lee as an apple store employee is in relation to Steve Jobs  If I have a problem with my iPhone  I don t expect Steve to fix it  I expect there to be reasonable infrastructure in place for me to be able to be helped with my problem at lower levels of apple  There are too many legitimate problems with government for you to be complaining that Lee doesn t personally meet with everyone who thinks they have a problem worthy of their time 
7456,"Lol I m not stereotyping  People who haven t had a smartohone need help setting it up  I ve been to the apple store and have seen it myself  Same when I have a question regarding an iPhone  I ll call apple or see a genius  Or maybe I ll go to one of those dreaded third party phone companies 

The reason something may now be intuitive has no reason to do with it being a government program  Republicans and to a lesser extent democrats have neglected unemployment for decades  It s not the bureocracy they are having issues with  it can be the servers  some from the 80s  "
7457,"Digging deep LOL man   commitment  But no  this is all false and misleading 

Biden has vowed to restore Palestinian aid  and like most sane people  supports a two state solution 

The  war on drugs  isn t supported by Biden or Democrats  His reform plan includes  decriminalize marijuana  eliminate mandatory minimum sentences for nonviolent crimes  end the death penalty  abolish private prisons 

Drone strikes are not a cut and dry topic and they never were  and  endless war  is a hollow phrase that ignores the complexity of the Middle East and of geopolitical challenges that we share with allies 

I can give you sources for all of this if you want  but the important thing is to point out that you re very literally wrong  Now maybe that s just a lack of information  or maybe you re on a mission  but the truth still matters either way "
7458,"Democrats literally fought tooth and nail to ge stimulus money to the people who need it  Multiple times  They re fighting as we speak 

It is  your  sense of  the establishment  which has no relation to reality  It is based in your own identity and  outsider  politics  rather than an honest assessment of who is doing good and who is doing bad in the world "
7459,"Both Pelosi and Biden support the Green New Deal 

Biden supports it explicitly  while Pelosi is dodgy but clearly has enacted green policies in all the legislation she leads  including the current stimulus bill "
7460," I don t agree with the view that voting for Biden would be  rewarding the behavior  of the party  It should be about expected policy outcomes first and foremost 

Biden said he would veto M4A  Biden was the pick of all the donors  strategists  and politicians who would break the party rather than let Sanders win  

 If you care about marginalized people and communities  it would make sense to want to lessen the harm done to them 

You think Biden and co give two fucks about this  Biden created the systems that he now talks about dismantling  These people believe in absolutely nothing except victory  and you re allowing them to lead you around by your sense of morality 

You posit this scenario as if I m in charge of policy   I just vote  I don t have power  so trying this moralizing thing is just silly  I didn t build those cages   Biden and Obama did  

I m sorry but all this is talk about lesser evil is a waste of time  The only thing that matters in politics is power and leverage  that s all Biden and co understand  The party will never let you in unless you break it or force it to adapt through leverage  You won t influence them by falling in line  the sooner you accept it the better  

Voting third party in a large enough block and loudly decrying these people is the only way they will pay attention "
7461,You re all concerned with people around the world while Biden is putting out policy like  this  https   twitter com JordanUhl status 1263234146337525762 s 19 
7462,Okay  Evidently  most voters feel differently  If they change their minds  they can vote Carter out  What s the point of this argument 
7463,"Well  luckily  Lee is on his second term so personal experience is covered   Secondly  I don t feel you need a formal education to effectively represent  your constituents   And by all regards  Lee is representing very well   

So  as a self proclaimed  socialist   why would you have an issue with a worker  in the position of pushing legislation for working people 

Unless you re a bad faith actor  which you are "
7464,"That s not at all what I said  and I m not sure why you ve read it like that 

  x200B 

What I said  and am happy to continue saying  is that education matters less than values  There are good uneducated people   a lot of them   and evil educated people   a lot of them  Given the choice between one from each category  I m not going to pick someone evil just because I like their credentials "
7465,What would make Lee qualified  You said a candidate would have to show you something as a state rep  Well  he s on his second term as a state rep and has some notable accomplishments like his bill to cap insulin prices  That helps a lot of people  I truly don t understand where you are coming from with this logic
7466,You should expect there to be effective infrastructure at the lower level of government agencies to be helped with any problem related to the service of the agency  You shouldn t need help from Lee s staff 
7467,"Democrats fought to prevent Medicare for All from being on the 2020 ticket harder than they fought for stimulus oversight   

You want my honest assessment  The Democratic party and the Republican party are more alike now than ever and I m pretty tired of it  Stop telling me it s not reality based to think that Democrats do bad things  because they have and will continue to  The same reason I don t vote Democrats any more is the same reason I could never ever vote Republican  A large chunk of the population doesn t vote either  are you going to tell them their perspectives aren t real too  Good luck "
7468,"I hope you re right but neither of those people are close to the leaders we need for such a task 

The New Deal is an instructive example  FDR was openly going directly against the interests of the business elites  who openly despised him in turn  Biden and Pelosi on the other hand try to make everyone happy by catering to business and public interests  but only the public so much as the business interests allow  You can look at Biden s record to see him actively fighting for business elites at every opportunity  

I m not saying at this point he s beyond pointing in a direction that will help people but we still need to demand better candidates than this "
7469,"  Biden said he would veto M4A 

While I don t trust him to actually fight for M4A   his answer was a bit more specific than that  https   www cnbc com 2020 03 10 biden says he wouldd veto medicare for all as coronavirus focuses attention on health html  

   I would veto anything that delays providing the security and the certainty of health care being available now   Biden responded   If they got that through in by some miracle or there s an epiphany that occurred and some miracle occurred that said   OK  it s passed   then you got to look at the cost  

  Biden added   I want to know  how did they find  35 trillion  What is that doing  Is it going to significantly raise taxes on the middle class  which it will  What s going to happen  

 nbsp 

  You posit this scenario as if I m in charge of policy   I just vote  I don t have power  so trying this moralizing thing is just silly  I didn t build those cages   Biden and Obama did 

Voting is a powerful tool because it decides who will be put in a position to enact policy  Because our current system provides two viable candidates in a presidential election  voting should be viewed through the prism of which of the two is more closely aligned to your preferred policies 

  I m sorry but all this is talk about lesser evil is a waste of time  The only thing that matters in politics is power and leverage  that s all Biden and co understand  The party will never let you in unless you break it or force it to adapt through leverage  You won t influence them by falling in line  the sooner you accept it the better 

  Voting third party in a large enough block and loudly decrying these people is the only way they will pay attention 

As Chomsky and Halle explain in the first two points at the end of the essay 

  1  Voting should not be viewed as a form of personal self expression or moral judgement directed in retaliation towards major party candidates who fail to reflect our values  or of a corrupt system designed to limit choices to those acceptable to corporate elites 

  2  The exclusive consequence of the act of voting in 2016 will be  if in a contested  swing state   to marginally increase or decrease the chance of one of the major party candidates winning 

I should ask  do you care about improving the plight of poor and working people not just stateside  but worldwide  If you do  then I m not sure how you can justify a third party vote that would marginally increase the chances of Trump winning  Again  it s inarguable that his policies would be more harmful to those people than Biden s  Framing it as  sticking it to the Democratic party  doesn t change that  

We re all responsible for the predictable consequences of our actions "
7470,"He s a reactionary  

Biden advised against two of the only positive Obama accomplishments   the Iran treaty and opening up relations with Cuba "
7471, deleted 
7472,"Unfortunately for your argument there are also a lot of both  evil  uneducated people and  good  educated people 

And while I can t know whether a candidate for public office is either  good  or  evil   again  I can make certain that they meet a minimum standard of qualification for that position "
7473,"  Democrats fought to prevent Medicare for All from being on the 2020 ticket harder than they fought for stimulus oversight   

Bullfuckingshit  

Your bothsidesism is grotesque  and only serves to help the R s  

I m sure you know it  and that s why you do it  Chapo "
7474,"I think Biden s record is way too mixed to write off as  business interest  friendly  

And it just doesn t change anything   he s running a progressive platform against a literal fascist tyrant  He s getting help and support from progressive voices  We re uniting for the greater good  and it s about damn time 

Progressivism is not a goal  it s a process  It s every rights movement  every protection agency  every oversight committee  every outreach effort to push new policies to the top  The process continues with a Biden election and a blue senate  It s not all or nothing  and it never was "
7475,I m not gona vote for a man who wants to run a hard line policy against palestinians 
7476," I should ask  do you care about improving the plight of poor and working people not just stateside  but worldwide 

Of course I do  Corporate Democrats like Biden do not  He is his voting record  

Until that wing of the party is either crushed or brought to heel  it won t change  They won  Why would Biden and the winners accept demands from the losers  Get real  

Third Way type corporate Democrats are on their way out  the Dem Party will do a whole lot more good in the world once this wing is out of power  These people will always put profit over people  that s their only value set  

We just have to accept that the next four years are totally lost  Biden or Trump won t fix anything  

Please for the love of God don t support someone you disagree with on everything  That s just insanity  Biden is woefully out of touch with the electorate  voting for him because your afraid of the orange Cheeto is the exact strategy Republicans use to scare conservatives into supporting their candidates "
7477,"  I should ask  do you care about improving the plight of poor and working people not just stateside  but worldwide  

No  he doesn t  Check his fucking profile  all he gives a real shit about is hurting Biden  Page after page after  page  with barely a glance at the Right wing  unless he can turn that around into shitting on Biden even harder 

He claims about caring about poor people  minorities  women and the like  but then turns around and spits in our faces by claiming that Biden is somehow fucking  worse then Trump  

That s all that Chapo poster does "
7478,As long as you can represent them well   What s the problem   socialist  
7479,You literally can know if they re evil based on the positions they campaign on  It s not difficult  It s not some opaque thing   people don t just campaign with qualifications  they also campaign with their positions on issues  Why would you choose to elect someone who has horrifying positions  just because you admire their pedigree 
7480,"
As a reminder  this subreddit  is for civil discussion    r politics wiki index wiki be civil 

In general  be courteous to others  Debate discuss argue the merits of ideas  don t attack people  Personal insults  shill or troll accusations  hate speech    any   advocating or wishing death physical harm  and other rule violations can result in a permanent ban  

If you see comments in violation of our rules  please report them 

 For those who have questions regarding any media outlets being posted on this subreddit  please click  here  https   www reddit com r politics wiki whitelist  to review our details as to whitelist and outlet criteria 

   


 I am a bot  and this action was performed automatically  Please  contact the moderators of this subreddit   message compose  to  r politics  if you have any questions or concerns  "
7481,We all know the answer is  it s illegal because Republicans will lose  
7482,Kayleigh is way in over her head at this post  she barely could handle late night CNN round tables 
7483,meanwhile I can very easily explain why if he does what he is threatening to do with withholding funds it is quite illegal 
7484,Of course she can t 
7485,Michigan Trump supporters better not mail in any ballots then  In fact  they should avoid voting altogether 
7486,Did she try the  blame Obama  or  blame China  broken records yet 
7487,"Haven t seen it mentioned here yet  but I found it funny that he deleted the tweet 

On that note  he isn t supposed to be deleting tweets   Those are considered  presidential records  aren t they "
7488,Don t worry she ll come up with some lie  before you know it
7489,"lol  down the page there is an ad stating   Happy Birthday President Donald Trump  Sign the card  Paid for by Trump MAGA Committee  

So Trump is spending money on advertisements to get people to sign a card for himself  This guy can t get any more pathetic  and yet he continually does   "
7490,Yup  The exact thing that the democrats warned about during the impeachment is happening and  true to form  this administration is struggling to backfill an explanation for Trump s illegal actions 
7491,Quick  back to Oann for a Q update to your talking points 
7492,"Here s a brief lesson in tells 

While there are some generally accurate tells  the most reliable tell is when someone says or does that s distinctly out of the ordinary for their behavior 

She s set a very clear and consistent behavior of checking her binder full of answers to cover a wide variety of questions  It s clear she s just an emotionless robot designed to spew Trump s bullshit  Whenever she s asked a question the first thing she does is flip to the page of talking points because she never has to actually think on her feet  On one hand you could argue that s being prepared  Another angle it comes off as inauthentic and highlighting that she doesn t actually know any of the talking points until she reads them 

When she was asked what specifically was illegal she didn t have an answer  She didn t have a talking point  Because there isn t one 

She deflected which was a very common feature of Sarah Sanders  She was deflection incarnate  Kayleigh has otherwise been the opposite    straight up has the talking point  Except not for this 

Trump doesn t have an answer for this because it s bogus  Sensible people know it s a bogus claim that it s illegal to have mail in ballots  There s not even a faint indication of a talking point  and that s all driven by how Kayleigh reacts to a question being asked  So whether it s this very obvious lie or another more subtle one  keep this in mind  If she doesn t check her binder and goes off the fly she has no fucking clue and also that Trump has no follow up 

All bark  no bite "
7493,It s difficult to find an acceptable way to say  because the king said not to  
7494,Because he is just being a fat fucking bully trying to scare people
7495,But Obama 
7496, That s a very nasty question  
7497,Threatening to  illegally  withhold funds from a swing state seems imprudent
7498,I laughed when Corruption Barbie took the stage for her very first presser and said  I ll never lie to you   That s the only thing she s done since then 
7499,I watched it live   she seriously fumbled over it and it seriously made no sense  It made no sense because it s all bullshit  We ve been doing mail in ballots for how long now  Suddenly it s no good and corrupt  I don t buy it one bit  Republicans  especially trump  do not want the people to vote  Again  THEY DO NOT WANT YOU TO BE ABLE TO VOTE 
7500,Just like Obamagate  When asked directly about what the actual complaint is  they can t just outright say  I don t like it   so they have to dance around and hope the base doesn t get too embarrassed to keep supporting the show even though it jumped the shark last season 
7501,Where s the look lOok lady  She was was so much better at brazenly lying to the media 
7502,Whenever Trump or one of his spokespeople says that something is illegal  the press needs to back them into a corner with a followup question about  What charges do you expected to be filed in this matter  to force them to admit that they have no idea what the laws they re supposed to be enforcing are 
